{
  "id": "e1",
  "title": "Festival Opening & Ambient Set",
  "type": "concert",
  "dayRef": "d1",
  "venueRef": "v1",
  "startTime": "2026-06-19T17:00:00",
  "endTime": "2026-06-19T18:00:00",
  "performerIds": [
    "p8"
  ],
  "description": "Oficiální otevření festivalu a ambientní úvodní set na River Stage."
}
